serving_size_raw_mintel,serving_size_raw_loblaws,serving_size_raw_exact_match,name_mintel,name_loblaws,name_exact_match,calories_mintel,calories_loblaws,calories_exact_match,saturatedfat_mintel,saturatedfat_loblaws,saturatedfat_exact_match,sodium_mintel,sodium_loblaws,sodium_exact_match,upc_code,total_match_count
50 g,50 g,True,Gourmet Brownie Squares,Gourmet Brownie Squares,True,190.0,190.0,True,3.0,3.0,True,0.14,0.14,True,628834878338.0,5
,113 g,False,Lamb Shoulder Blade Chops,Lamb Shoulder Blade Chops,True,,280.0,False,,9.0,False,,0.07,False,628912104076.0,1
140 g,,False,Peaches Yogurt,3.2% Canadian Harvest Peach Yogurt,False,120.0,,False,2.0,,False,0.075,,False,629025410399.0,0
140 g,,False,Raspberries-Cranberries Yogurt,3.2% Canadian Harvest Raspberry-Cranberry Yogurt,False,120.0,,False,2.0,,False,0.075,,False,629025410405.0,0
175 g,,False,Cherry Yogurt,3.2% Canadian Harvest Cherry Yogurt,False,150.0,,False,3.0,,False,0.09,,False,629025410429.0,0
175 g,,False,Blueberry Yogurt,3.2% Canadian Harvest Blueberry Yogurt,False,150.0,,False,3.0,,False,0.085,,False,629025410436.0,0
175 g,,False,Plain Yogurt,3.8% Canadian Harvest Plain Yogurt,False,130.0,,False,4.0,,False,0.095,,False,629025410443.0,0
175 g,,False,Maple Syrup Yogurt,3.2% Canadian Harvest Maple Syrop Yogurt,False,150.0,,False,3.0,,False,0.09,,False,629025410450.0,0
175 g,100 g,False,Strawberry Yogurt 0%,"Yogurt, Strawberry 0%",False,100.0,35.0,False,0.0,0.0,True,0.09,0.05,False,629025420077.0,1
,,False,Decaffeinated Dark Coffee,"Organic Dark Roast, Swiss Water Process Decaf",False,,,False,,,False,,,False,629070100146.0,0
,,False,454 Horse Power Dark Ground Coffee,Organic Dark 454 Horse Power,False,,,False,,,False,,,False,629070900159.0,0
250 ml,,False,Peach-Nectarine Flavoured Energy Drink,"Red Bull Energy Drink, Peach, 250 ml (4 Pack)",False,110.0,,False,,,False,0.09,,False,629071000292.0,0
250 ml,,False,Watermelon Energy Drink,Watermelon,False,110.0,,False,,,False,0.09,,False,629071000421.0,0
300 ml,300 ml,True,Blue Lemonade Organic Probiotic Hydrator Drink,Probiotic Hydrator Blue Lemonade,False,15.0,15.0,True,0.0,0.0,True,0.01,0.01,True,629118200012.0,4
340 ml,,False,Ultraviolet Organic Kombucha,Greenhouse Kombucha Ultraviolet Organic,False,35.0,,False,0.0,,False,0.0,,False,629118400054.0,0
15 ml,15 ml,True,California Fig Balsamic Vinegar,O Olive Oil Vinegar California Fig Balsamic,False,15.0,0.0,False,,0.0,False,,0.0,False,634039350210.0,1
44 g,44 G,False,Caramel Chocolaty Nut Roll Protein Bars,"Advantage, Caramel Chocolate Nut Roll",False,180.0,180.0,True,5.0,5.0,True,0.19,0.19,True,637480015134.0,3
28 g,28 g,True,Chewy Fudge Premium Brownie Mix,Chewy Fudge Brownie Mix,False,110.0,110.0,True,1.0,1.0,True,0.1,0.1,True,644209021345.0,4
43 g,43 g,True,Spice Cake Mix,"Cake Mix, Spice",False,170.0,170.0,True,2.0,1.0,False,0.35,0.27,False,644209022120.0,2
38 g,38 g,True,Angel Food Cake Mix,"Cake Mix, Angel Food",False,140.0,140.0,True,0.0,0.0,True,0.28,0.27,False,644209022205.0,3
35 g,35 g,True,Creamy Milk Chocolate Frosting,"Creamy Home-Style Frosting, Milk Chocolate",False,130.0,140.0,False,2.0,1.5,False,0.09,0.09,True,644209022250.0,2
35 g,35 g,True,Creamy Chocolate Frosting,"Creamy Home-Style, Chocolate",False,130.0,140.0,False,2.0,1.5,False,0.1,0.1,True,644209022274.0,2
35 g,35 g,True,Creamy Cream Cheese Frosting,"Creamy Home-Style, Cream Cheese",False,140.0,140.0,True,2.0,1.5,False,0.07,0.07,True,644209022298.0,3
200 ml,200 ml,True,Organic Apple Juice Drink,Kids Juice Drink from Concentrate Apple Organic,False,40.0,40.0,True,0.0,0.0,True,0.015,0.015,True,657622013002.0,4
200 ml,200 ml,True,Organic Fruit Punch Juice Drink,Kids Juice Drink from Concentrate Fruit Punch Organic,False,40.0,40.0,True,0.0,0.0,True,0.015,0.015,True,657622013019.0,4
200 ml,200 ml,True,Organic Berry Lemonade Juice Drink,Kids Juice Drink from Concentrate Berry Lemonade Organic,False,40.0,40.0,True,0.0,0.0,True,0.015,0.015,True,657622013026.0,4
40 g,40 g,True,Organic Sliced Dried Cranberries,Organic Classic Sweetened Dried Cranberries Halves,False,130.0,130.0,True,0.0,0.0,True,0.002,0.0,False,662166551668.0,3
40 g,40 g,True,Organic Dried Cranberries,Organic Classic Dried Cranberries Sweetened with Apple Juice Halves,False,130.0,130.0,True,0.0,0.0,True,0.01,0.01,True,662166551774.0,4
50 g,,False,Moka Moments Active Blend,Active Blend Moka Moments Organic,False,240.0,,False,4.0,,False,0.002,,False,662166552078.0,0
6 g,,False,Candy,"Halloween Monster Mx, 1.75Kg",False,20.0,,False,0.0,,False,0.0,,False,662572582751.0,0
15 g,15 G,False,Classic Hot Chocolate Mix K-Cup Pods,Laura Secord Hot Chocolate Mix,False,60.0,60.0,True,1.0,1.5,False,0.18,0.18,True,663447217907.0,2
,,False,Espresso Dark Roast Whole Bean Arabica Coffee,McCafe Whole Bean Espresso,False,,,False,,,False,,,False,663447608200.0,0
,,False,Premium Medium Dark Roast Fine Ground Arabica Coffee,McCafe Premium Roast Bag,False,,,False,,,False,,,False,663447608217.0,0
,,False,Premium Medium Dark Roast Decaffeinated Fine Ground Arabica Coffee,McCafe Decaf Premium Roast,False,,,False,,,False,,,False,663447608224.0,0
,,False,Premium Medium Dark Roast Whole Bean Arabica Coffee,McCafe Whole Bean Premium Roast,False,,,False,,,False,,,False,663447608231.0,0
,,False,Premium Medium Dark Roast Decaffeinated Fine Ground Arabica Coffee,McCafe Decaf Roast Pod,False,,,False,,,False,,,False,663447608255.0,0
,,False,Premium Medium Dark Roast Fine Ground Coffee K-Cup Pods,McCafe Premium Roast Pod,False,,,False,,,False,,,False,663447608262.0,0
100 g,110 g,False,Seafood Mix,Seafood Medley,False,60.0,60.0,True,0.0,0.2,False,0.24,0.24,True,663925101056.0,2
20 g,20 g,True,Honey with Royal Jelly,Honey with Royal Jelly,True,60.0,60.0,True,,0.0,False,0.001,0.001,True,664319100037.0,4
20 g,14 g,False,Buckwheat Honey,Buckwheat Honey,True,60.0,45.0,False,,0.0,False,0.001,0.001,True,664319500066.0,2
,,False,Yeast Extract,Marmite,False,,,False,,,False,,,False,667803001506.0,0
60 g,60 g,True,Cheese Crisps,GRANAROLO CHEESE CRISPS,False,340.0,340.0,True,17.0,17.0,True,0.38,0.38,True,670346380403.0,4
60 g,60 g,True,Tomato and Herbs Cheese Crisps,GRANAROLO CHEESE CRISPS TOMATO,False,350.0,350.0,True,17.0,17.0,True,0.48,0.48,True,670346385699.0,4
15 ml,15 ml,True,Sushi Rice Seasoning,Sushi Rice Seasoning,True,30.0,30.0,True,0.0,0.0,True,0.33,0.33,True,670452888015.0,5
2.5 g,100 g,False,Roasted Seaweed Sheets,Seaweed Sheets,False,10.0,35.0,False,0.0,0.1,False,0.02,0.05,False,670452888022.0,0
15 g,15 g,True,Pickled Ginger,Pickled Ginger,True,5.0,5.0,True,,0.0,False,0.055,0.055,True,670452888039.0,4
5 g,5.0 g,False,Wasabi Flavoured Paste,Wasabi Flavoured Horseradish,False,15.0,15.0,True,0.0,0.0,True,0.105,0.105,True,670452888046.0,3
15 ml,15 ml,True,Soy Sauce,Soy Sauce,True,15.0,15.0,True,,0.0,False,0.87,0.87,True,670452888077.0,4
13 g,13 g,True,Rice Paper Sheets,Rice Paper Sheets,True,45.0,45.0,True,0.0,0.0,True,0.125,0.125,True,670452888107.0,5
44 g,,False,Chocolate Maple Hazelnut Flavour Bar,Maple Hazelut Bar,False,240.0,,False,6.0,,False,0.08,,False,670834002138.0,0
48 g,,False,Blueberry Lemon Bar,Key-To Life Bar - Blueberry Lemon,False,270.0,,False,8.0,,False,0.085,,False,670834002145.0,0
44 g,,False,Red Velvet Flavour Bar,Key-To Life Bar - Red Velvet,False,240.0,,False,6.0,,False,0.045,,False,670834002152.0,0
60 g,30 g,False,Gluten Free Cinnamon & Raisin Loaf,Cinnamon & Raisin Bread,False,150.0,80.0,False,0.0,0.0,True,0.22,0.13,False,671521400305.0,1
66 g,,False,Gluten Free Whole Grain Wide Slice Loaf,Bread Wholegrain,False,170.0,,False,0.0,,False,0.25,,False,671521400503.0,0
10 ml,14 g,False,Pure Sesame Oil,Sesame Oil,False,80.0,120.0,False,1.0,2.0,False,,0.0,False,672774013953.0,0
15 ml,5.0 ml,False,Oyster Sauce,Oyster Sauce,True,20.0,5.0,False,0.0,0.0,True,0.42,0.125,False,672774014226.0,2
17 g,11 g,False,Spring Roll Wrappers,Spring Roll Wrappers,True,60.0,35.0,False,,0.0,False,0.115,0.11,False,672774105818.0,1
15 ml,5.0 ml,False,Fish Sauce,Fish Sauce,True,10.0,0.0,False,0.0,0.0,True,1.0,0.53,False,672774105894.0,2
60 ml,,False,Pad Thai Sauce,Sauce Pad Thai,False,100.0,,False,0.0,,False,0.34,,False,672774105948.0,0
60 ml,,False,Peanut Satay Sauce,Blue Dragon Satay Sauce,False,130.0,,False,0.0,,False,0.2,,False,672774105955.0,0
285 g,,False,Chickpea Korma with Green Beans and Cauliflower,Korma Chickpea Ready to Eat,False,290.0,,False,9.0,,False,0.85,,False,672774105979.0,0
285 g,,False,Lentil Tikka Masala with Pumpkin and Sweet Peppers,Lentil Tikka Masala Ready to Eat,False,190.0,,False,0.0,,False,1.0,,False,672774105986.0,0
285 g,,False,Butter Chickpeas with Sweet Potatoes and Spinach,Butter Chickpeas Ready to Eat,False,260.0,,False,4.0,,False,0.87,,False,672774105993.0,0
15 ml,30 ml,False,Thai Red Curry Paste,Thai Red Curry Paste,True,25.0,60.0,False,0.0,0.0,True,0.24,0.46,False,672774116074.0,2
15 ml,30 ml,False,Thai Green Curry Paste,Thai Green Curry Paste,True,20.0,35.0,False,0.0,0.0,True,0.32,0.17,False,672774116098.0,2
20 g,20 g,True,"Organic Pumpkin, Quinoa & Flax Seeds Dark Chocolate ClustersPumpkin, Quinoa & Flax Seeds Dark Chocolate Clusters","Organic Dark Chocolate Clusters with Pumpkin, Quinoa, & Flax Seeds",False,110.0,110.0,True,5.0,5.0,True,0.025,0.025,True,677210090550.0,4
100 g,100 g,True,Organic Raw & Easy-Peel Large Black Tiger Shrimp,Shrimp Organic Large Black Tiger,False,70.0,70.0,True,0.0,0.1,False,0.33,0.33,True,678044002207.0,3
100 g,100 g,True,Organic Raw Large Black Tiger Shrimp,Shrimp Organic Large Black Tiger,False,70.0,70.0,True,0.0,0.1,False,0.33,0.33,True,678044002221.0,3
100 g,100 g,True,Raw and Easy Peel Wild Argentinian Shrimp,Green Ocean Go Wild Argentinian Shrimp Jumbo,False,100.0,100.0,True,0.0,0.0,True,0.28,0.28,True,678044002276.0,4
100 g,100 g,True,"Raw, Peeled & Deveined Wild Argentinian Shrimp","Go Wild, Wild Argentinian Shrimp",False,100.0,100.0,True,0.0,0.0,True,0.28,0.28,True,678044002283.0,4
20 g,per 20 g / servings per container 7,False,"Organic Artisan Crisps with Raisin, Pecan & Rosemary",Org. Mini Pecan & Raisin,False,80.0,80.0,True,0.0,0.3,False,0.19,0.13,False,678629900010.0,1
20 g,per 20 g / servings per container 7,False,Organic Artisan Crisps with Cranberry & Hazelnut,Org Mini Hazelnut & Cranberry,False,70.0,80.0,False,0.0,0.0,True,0.19,0.16,False,678629900041.0,1
20 g,20 g,True,Organic Artisan Crisps with Cranberry & Cashew,"Organic Crisps, Cranberry & Cashew",False,70.0,70.0,True,0.0,0.0,True,0.13,0.13,True,678629900072.0,4
28 g,,False,Roasted Lightly Salted Chickpeas,Lightly Salted Roasted Chickpeas,False,100.0,,False,0.0,,False,0.17,,False,679339000212.0,0
125 ml,125 ml,True,Hearts of Palm in Slices,Heart of Palm Pieces,False,30.0,30.0,True,0.0,0.0,True,0.32,0.32,True,680852900033.0,4
375 ml,,False,Lemon Cucumber Flavoured Sparkling Water,"Carbonated Artesian Mineralised Sparkling Water, Lemon Cucumber",False,0.0,,False,,,False,0.04,,False,682430179107.0,0
375 ml,,False,Tangerine Lemongrass Flavoured Sparkling Water,"Carbonated Artesian Mineralised Sparkling Water, Tangerine Lemongrass",False,0.0,,False,,,False,0.04,,False,682430179206.0,0
50 g,,False,Unsalted Mixed Nuts,Mixed Nuts Unsalted,False,290.0,,False,3.0,,False,0.003,,False,685220000896.0,0
50 g,50 g,True,Dry Roasted Sea Salted Cashews,Cashews Dry Roasted Salted,False,290.0,290.0,True,4.0,4.5,False,0.32,0.32,True,685220007086.0,3
50 g,,False,Dry Roasted Sea Salted Almonds,Dry Roasted Almonds Salted,False,280.0,,False,2.0,,False,0.14,,False,685220007109.0,0
50 g,50 g,True,Peanut Butter Protein Cookie,"Protein Cookie, Peanut Butter",False,220.0,220.0,True,1.0,1.5,False,0.18,0.18,True,686207007044.0,3
20 g,20 g,True,Strawberry Vanilla Snack Bar,"Kids Protein Bar, Strawberry Vanilla",False,70.0,70.0,True,0.0,0.1,False,0.06,0.055,False,686207401019.0,2
24 g,24 g,True,Chocolate Chip Granola Bars,"Organic Granola Bars, Chocolate Chip",False,100.0,100.0,True,1.0,1.0,True,0.01,0.01,True,687456213019.0,4
24 g,24 g,True,Mixed Berry Granola Bars,"Organic Granola Bars, Mixed Berry",False,90.0,90.0,True,0.0,0.3,False,0.01,0.01,True,687456213026.0,3
22 g,22 g,True,Vanilla Crispy Squares,Crispy Squares Vanilla 6 Bars x (132 g),False,90.0,90.0,True,1.0,1.0,True,0.075,0.075,True,687456213262.0,4
24 g,24 g,True,Strawberry Granola Minis,Strawberry Granola Minis,True,90.0,90.0,True,0.0,0.3,False,0.01,0.01,True,687456224022.0,4
55 g,55 g,True,Strawberry Crispy Light Granola,Granola Strawberry,False,250.0,250.0,True,1.0,1.0,True,0.065,0.065,True,687456283074.0,4
24 g,24 g,True,Chocolate Banana Soft Baked Mini Cookies,Soft Baked Mini Cookies Chocolate Banana,False,120.0,120.0,True,2.0,2.5,False,0.065,0.065,True,687456283111.0,3
55 g,55 g,True,Cocoa Crunch Crispy Light Granola,Granola Cocoa Crunch,False,260.0,260.0,True,2.0,2.5,False,0.065,0.065,True,687456283128.0,3
24 g,24 g,True,Sweet Cinnamon Soft Baked Mini Cookies,"Made Good Soft Baked Mini Cookies, Cinnamon",False,110.0,110.0,True,2.0,2.0,True,0.07,0.07,True,687456283432.0,4
4 g,4 g,True,Monk Fruit Sweetener,Monk Fruit Sweetener,True,0.0,0.0,True,,0.0,False,,0.0,False,688120024542.0,3
43 g,43 g,True,Devil's Food Chocolate Cake Mix,Devil's Food Layer mix,False,170.0,170.0,True,2.0,1.5,False,0.37,0.49,False,691479122210.0,2
36 g,36 g,True,Lemon Cake Mix,Signature Lemon Cake,False,150.0,150.0,True,2.0,2.0,True,0.29,0.29,True,691479122302.0,4
397 g,,False,Buffalo-Style Chicken Mac 'n Cheese,Buffalo Mac n Cheese Bowl,False,460.0,,False,6.0,,False,2.0,,False,691479202387.0,0
45 g,45 g,True,Brownie Crunch Bar,"Slim Bar, Brownie Crunch",False,190.0,190.0,True,2.0,2.5,False,0.16,0.16,True,691535201019.0,3
45 g,45 g,True,Raspberry Truffle Bar,"Slim Bar, Raspberry Truffle",False,160.0,160.0,True,2.0,2.0,True,0.17,0.17,True,691535205017.0,4
50 g,50 g,True,Mint Chocolate Chip Bar,10 G Protein - Gluten Free - Ou Pareve - Non-Gmo Project Verified,False,200.0,200.0,True,3.0,3.0,True,0.16,0.16,True,691535525016.0,4
18 g,18 g,True,Organic Coconut Flour,Organic Coconut Flour,True,60.0,60.0,True,3.0,3.5,False,0.015,0.015,True,692752105685.0,4
37 g,37 g,True,Classic Organic Hazelnut Spread,Organic Hazelnut Spread Classic,False,210.0,210.0,True,5.0,6.0,False,0.0,0.0,True,692752107375.0,3
14 g,14 g,True,Organic Coconut Butter,Coconut Manna Pouch,False,100.0,100.0,True,9.0,9.0,True,0.0,0.0,True,692752110528.0,4
14 g,14 g,True,Organic Chocolate Coconut Butter,Coconut Manna Pouch Chocolate,False,80.0,80.0,True,7.0,7.0,True,0.01,0.01,True,692752110566.0,4
227 g,227 g,True,Homestyle Prime Rib Beef Burgers,"Prime Burger, 8OZ",False,650.0,660.0,False,24.0,24.0,True,0.88,1.17,False,695676006151.0,2
5 ml,5 ml,True,Keg Extra Hot Prepared Horseradish,Prepared Horseradish Keg Extra Hot 250 ml,False,5.0,5.0,True,0.0,0.0,True,0.045,0.07,False,695676008018.0,3
45 g,,False,Dark Chocolate Almond Sea Salt Bar,Hemp Bar Dark Chocolate Almond,False,230.0,,False,4.0,,False,0.14,,False,697658692352.0,0
45 g,,False,Dark Chocolate & Cocoa Nibs Bar,Hemp Bar Dark Chocolate Cocoa Nibs,False,220.0,,False,4.0,,False,0.095,,False,697658692383.0,0
45 g,45 g,True,Coconut Cashew Dark Chocolate Bar,Hemp Bar Coconut Cashew Dark Chocolate,False,230.0,230.0,True,6.0,6.0,True,0.075,0.075,True,697658692413.0,4
100 g,85 g,False,Honey Dijon Kale Vegetable Salad Kit,Sunflower Kale Vegetable Salad Kit,False,130.0,110.0,False,0.0,0.5,False,0.16,0.115,False,709351301407.0,0
100 g,85 g,False,Sweet Kale Vegetable Salad Kit,Sweet Kale Salad Kit,False,170.0,150.0,False,1.0,1.5,False,0.16,0.15,False,709351891458.0,0
15 ml,per 15 ml,False,Apple Cider Vinegar,Organic Apple Cider Vinegar,False,0.0,0.0,True,0.0,0.0,True,0.0,0.0,True,710996000709.0,3
156 g,156 g,True,Fries & Chicken Bites,Michelina's Zap'ems Fries & Chicken Bites,False,250.0,250.0,True,1.0,1.5,False,0.3,0.3,True,717854212113.0,3
227 g,227 g,True,Light Macaroni and Cheese,Michelina's Macaroni and Cheese,False,240.0,240.0,True,3.0,3.0,True,0.62,0.62,True,717854214018.0,4
50 g,50 g,True,Coconut & Almond Butter Bar,"Energy Bar, Coconut Almond Butter (Case)",False,230.0,230.0,True,3.0,3.0,True,0.15,0.15,True,722252028150.0,4
50 g,50 g,True,Peanut Butter Bar,"Energy Bar, Peanut Butter (Case)",False,230.0,230.0,True,2.0,2.5,False,0.16,0.16,True,722252028280.0,3
68 g,68 g,True,Chocolate Almond Fudge Energy Bar,"Energy Bar, Chocolate Almond Fudge",False,250.0,250.0,True,1.0,1.5,False,0.16,0.14,False,722252124227.0,2
50 g,50 g,True,Chocolate & Peanut Butter Bar,"Energy Bar, Chocolate Peanut Butter (Case)",False,230.0,230.0,True,2.0,2.5,False,0.15,0.15,True,722252128201.0,3
68 g,68 g,True,Chocolate Peanut Butter Protein Bar,"Builder's Bar, Peanut Butter",False,290.0,290.0,True,6.0,6.0,True,0.33,0.33,True,722252606419.0,4
68 g,68 g,True,Chocolate Flavour Protein Bar,"Builder's Bar, Chocolate",False,280.0,280.0,True,6.0,6.0,True,0.21,0.21,True,722252606426.0,4
68 g,68 g,True,Chocolate Mint Flavour Protein Bar,"Builder's Bar, Chocolate Mint",False,280.0,280.0,True,6.0,6.0,True,0.2,0.2,True,722252606440.0,4
68 g,68 g,True,Vanilla Almond Protein Bar,"Builder's Protein Bar, Vanilla Almond",False,290.0,270.0,False,6.0,5.0,False,0.2,0.22,False,722252606457.0,1
480 ml,480 ml,True,Trilogy Organic Kombucha Drink,Kombucha Synergy Trilogy Organic & Raw,False,50.0,60.0,False,0.0,0.0,True,0.02,0.02,True,722430110479.0,3
480 ml,480 ml,True,Gingerade Kombucha Drink,GT's Kombucha Gingerade Organic & Raw Kombucha Drink,False,50.0,60.0,False,0.0,0.0,True,0.01,0.02,False,722430200477.0,2
480 ml,480 ml,True,Gingerberry Organic & Raw Kombucha Drink,Synergy Organic & Raw Gingerberry Kombucha Drink 1.4 L,False,50.0,50.0,True,0.0,0.0,True,0.02,0.02,True,722430600475.0,4
19 g,,False,Original Cheddar Cheese Sticks,Macy'S Orig Ched Cheesestk,False,90.0,,False,2.0,,False,0.115,,False,724923101902.0,0
19 g,,False,Garlic Romano Cheese Sticks,CheeseSticks Garlic Romano,False,80.0,,False,2.0,,False,0.12,,False,724923103906.0,0
19 g,,False,Melting Parmesan Cheese Sticks,CheeseSticks Melting Parmesan,False,90.0,,False,3.0,,False,0.135,,False,724923111901.0,0
45 g,45 g,True,Pure Original Basmati,"Pure Basmati Rice, Bag",False,160.0,160.0,True,0.0,0.0,True,0.0,0.0,True,725299030346.0,4
40 g,,False,Cassava Chips with Sea Salt,Cassava Sea Salt,False,200.0,,False,6.0,,False,0.16,,False,728229015635.0,0
40 g,40 g,True,Mediterranean Exotic Vegetable Chips,"Vegetable Chips, Mediterranean",False,220.0,210.0,False,1.0,1.5,False,0.22,0.21,False,728229123583.0,1
40 g,40 g,True,Blues Potato Chips with Sea Salt,Blue,False,180.0,180.0,True,1.0,1.0,True,0.16,0.16,True,728229129547.0,4
40 g,40 g,True,Plantain Vegetable Chips,Exotic Vegetable Chips Plantains Sea Salt,False,210.0,0.0,False,9.0,9.0,True,0.11,0.11,True,728229140603.0,3
40 g,40 g,True,Original Exotic Vegetable Chips,Exotic Vegetables Chips,False,200.0,200.0,True,1.0,1.0,True,0.11,0.11,True,728229900016.0,4
125 g,125 g,True,Pacific Pink Salmon Skin-On Fillets,Pacific Salmon Fillets,False,150.0,150.0,True,0.0,0.5,False,0.085,0.085,True,731149515062.0,3
,,False,Intenso Bold Roast Ground Illy Blend Coffee,Ground Espresso Intenso Bold Roast,False,,,False,,,False,,,False,733411000085.0,0
55 g,55 g,True,Crunchy Baked Oats Granola,Simply Granola Crunchy Baked Oats,False,230.0,230.0,True,2.0,2.0,True,0.005,0.005,True,737282350874.0,4
32 g,32 g,True,Crunchy Sunflower Butter,SunButter Original Crunch,False,200.0,200.0,True,1.0,2.0,False,0.13,0.12,False,737539190864.0,2
14 g,15 G,False,Red Curry Paste,Red Curry Paste,True,15.0,20.0,False,0.0,0.0,True,0.33,0.35000000000000003,False,737628003006.0,2
15 g,15 G,False,Green Curry Paste,Green Curry Paste,True,15.0,15.0,True,0.0,0.0,True,0.35,0.35000000000000003,False,737628004003.0,3
30 ml,30 ML,False,Peanut Satay Sauce,Peanut Satay Sauce,True,80.0,80.0,True,2.0,2.5,False,0.19,0.22,False,737628005000.0,2
83 ml,79 ml,False,Unsweetened Premium Coconut Milk,Coconut Milk,False,150.0,140.0,False,13.0,12.0,False,0.02,0.02,True,737628011506.0,1
17 g,18 g,False,Yellow Curry Paste,Yellow Curry Paste,True,35.0,35.0,True,0.0,0.4,False,0.43,0.47,False,737628012008.0,2
13 g,13 g,True,70% Cacao Extra Dark Chocolate,Lindt 70% Cacao,False,80.0,80.0,True,5.0,5.0,True,0.01,0.01,True,743434000986.0,4
13 g,,False,Strawberries & Cream Flavoured White Chocolate,Lindor Strawberries & Cream,False,80.0,,False,4.0,,False,0.01,,False,743434007206.0,0
68 ml,68 ml,True,Vanilla Bean Coconut Dipped Bars,"Coconut Dairy-Free Frozen Dessert Bars, Vanilla with Chocolate coating,68ml (Pack of 4)",False,170.0,160.0,False,10.0,10.0,True,0.0,0.025,False,744473274116.0,2
250 ml,250 ml,True,Organic Unsweetened Coconut Beverage,"So Delicious Coconut Beverage, Unsweetened, Dairy-Free, 946ml",False,45.0,45.0,True,4.0,4.0,True,0.015,0.015,True,744473292059.0,4
250 ml,250 ml,True,Organic Original Coconut Beverage,"So Delicious Coconut Beverage, Original, Dairy-Free, 946ml",False,70.0,70.0,True,4.0,4.0,True,0.015,0.015,True,744473292103.0,4
125 ml,125 ml,True,Holiday Nog Coconut Seasonal Beverage,Coconut Milk Holiday Nog,False,90.0,90.0,True,2.0,2.0,True,0.12,0.12,True,744473293315.0,4
12 g,12 g,True,Coconut Whipped Topping,Dairy-Free Whipping Cream,False,30.0,30.0,True,2.0,1.5,False,0.0,0.0,True,744473299973.0,3
30 g,15 G,False,Sea Salt Caramel Dark Chocolate,Chocolate,False,140.0,70.0,False,5.0,2.5,False,0.065,0.03,False,747599303142.0,0
250 ml,240 ml,False,100% Litchi Juice Blend,Litchi Juice,False,130.0,120.0,False,0.0,0.0,True,0.015,0.01,False,751217123456.0,1
250 ml,240 ml,False,Medley of Fruits Juice Blend,Fruit Medley Juice,False,120.0,130.0,False,0.0,0.0,True,0.015,0.01,False,751217123494.0,1
28 g,28 g,True,Simply Dark Hot Chocolate,Organic Simply Dark Hot Chocolate,False,,120.0,False,1.0,1.0,True,0.003,0.003,True,752612000298.0,3
40 g,40 g,True,Milk Chocolate with 38% Cacao and a Hint of Hazelnut,Organic Milk Chocolate Bar,False,230.0,230.0,True,9.0,9.0,True,0.04,0.04,True,752612100158.0,4
40 g,40 g,True,Almond Dark Chocolate with 55% Cacao,"Organic Dark Chocolate Bar, Almonds 55%",False,230.0,230.0,True,8.0,9.0,False,0.0,0.0,True,752612100165.0,3
40 g,40 g,True,Bittersweet Dark Chocolate with 71% Cacao,Organic Bittersweet Chocolate Bar,False,230.0,230.0,True,10.0,11.0,False,0.0,0.0,True,752612100172.0,3
40 g,40 g,True,Extra Dark Chocolate with 80% Cacao,"Organic Dark Chocolate Bar, Panama Extra Dark 80%",False,240.0,240.0,True,12.0,12.0,True,0.0,0.0,True,752612100349.0,4
125 ml,125 g,False,Wild Mushroom Pasta Sauce,Wild Mushroom,False,80.0,60.0,False,0.0,0.5,False,0.37,0.27,False,753469010034.0,0
47 g,,False,Outlaw Spicy BBQ Rolled Tortilla Chips,Barcel Takis Outlaw,False,250.0,,False,3.0,,False,0.18,,False,757528040666.0,0
10 ml,10 ml,True,100% Pure Vegetable Oil,Vegetable Oil,False,80.0,80.0,True,1.0,1.5,False,,0.0,False,761720000144.0,2
10 ml,10 ml,True,100% Pure Canola Oil,Canola Oil,False,80.0,80.0,True,0.0,0.5,False,,0.0,False,761720192085.0,2
10 ml,10 ml,True,100% Pure Corn Oil,Corn Oil,False,80.0,80.0,True,1.0,1.0,True,,0.0,False,761720192115.0,3
,,False,True North Blend Ground Coffee K-Cup Pods,Starbucks True North Blend Blonde Roast Ground Coffee K-Cup Pods,False,,,False,,,False,,,False,762111204684.0,0
,,False,Torréfaction Italian Dark Roast Ground Coffee,Italian Roast ground coffee,False,,,False,,,False,,,False,762111300096.0,0
,,False,Pumpkin Spice Flavoured Ground Coffee K-Cup Pods,Pumpkin Spice Flavoured Ground Coffee K-Cup Pods,True,,,False,,,False,,,False,762111311122.0,1
125 ml,,False,Signature Black Coffee Concentrate,"Cold Brew Coffee Concentrate, Signature Black",False,10.0,,False,,,False,,,False,762111426659.0,0
,,False,French Roast Dark Roast Ground Coffee,French Roast R&G,False,,,False,,,False,,,False,762111898043.0,0
,,False,Holiday Blend Medium Roast Ground Coffee K-Cup Pods,K-CUP Roast Ground Coffee Holiday Blend,False,,,False,,,False,,,False,762111984142.0,0
,,False,Caramel Flavoured Ground Coffee,Breakfast Blend Whole Bean coffee,False,,,False,,,False,,,False,762111985330.0,0
30 g,30 g,True,Mild Guacamole,Spicy Guacamole,False,50.0,50.0,True,0.0,0.5,False,0.14,0.12,False,767119321692.0,2
57 g,57 g,True,Guacamole,Guacamole Authentic Flavor 6 Cups,False,100.0,100.0,True,1.0,0.0,False,0.257,0.26,False,767119520682.0,2
30 g,30 g,True,Guacamole,Authentic Guacamole,False,50.0,50.0,True,0.0,0.5,False,0.135,0.12,False,767119521696.0,2
30 g,,False,Guacamole Squeeze,Squeeze Guacamole,False,50.0,,False,0.0,,False,0.14,,False,767119724509.0,0
28 g,per 28 g,False,Reserve Cheddar Cheese,"Irish Cheddar, 2-Year Aged",False,110.0,110.0,True,6.0,6.0,True,0.21,0.21,True,767707001586.0,3
30 g,30 g,True,Roasted Garlic Hummus,"Organic Hummus, Roasted Garlic",False,80.0,80.0,True,0.0,0.5,False,0.12,0.12,True,770333026526.0,3
30 g,30 g,True,Traditional Hummus,"Organic Hummus, Traditional",False,80.0,80.0,True,0.0,0.5,False,0.12,0.12,True,770333026557.0,3
150 g,,False,Blueberry Vanilla Ready-to-Eat Oat Bowl,Oat Bowl Vanilla 3 Pack,False,210.0,,False,3.0,,False,0.2,,False,773200718470.0,0
150 g,,False,Apple Cinnamon Ready-to-Eat Oat Bowl,Oatbowl Apple Cinnamon 3 Pack,False,230.0,,False,4.0,,False,0.2,,False,773200718487.0,0
150 g,,False,Vanilla Ready-to-Eat Oat Bowl,Oatbowl Vanilla 3 Pack,False,270.0,,False,6.0,,False,0.2,,False,773200718494.0,0
140 g,,False,Barbeque Sweet Asian BBQ Pulled Pork in Sweet & Savoury Sauce,Asian Pulled Pork,False,280.0,,False,4.0,,False,0.76,,False,773220104048.0,0
140 g,140 g,True,Barbeque Pulled Pork in Lou's Barbeque Sauce,Pulled Pork,False,280.0,280.0,True,5.0,5.0,True,0.29,0.29,True,773220104055.0,4
140 g,100 g,False,Homestyle Philly-Style Shaved Steak,Philly Style Shaved Steak,False,200.0,120.0,False,3.0,1.5,False,0.62,0.45,False,773220105045.0,0
140 g,140 g,True,Homestyle Beef Pot Roast Au Jus,Roast Beef au Jus,False,270.0,270.0,True,6.0,6.0,True,0.44,0.44,True,773220105069.0,4
140 g,140 g,True,Homestyle Shaved Beef Au Jus,Shaved Beef au Jus,False,210.0,210.0,True,4.0,4.0,True,0.59,0.59,True,773220105144.0,4
32 g,32 g,True,Creamy Toasted Soy Spread,Soy Spread Toasted 5 To-Go Cups,False,190.0,190.0,True,3.0,3.0,True,0.1,0.1,True,773948500009.0,4
